{"$schema":"http://json-schema.org/draft-07/schema#","properties":{"chosen":{"properties":{"artifact_sha256":{"type":"string"},"teacher":{"type":"string"},"verdict":{"enum":["GOLD","SILVER","FAIL"]}},"required":["teacher","verdict","artifact_sha256"],"type":"object"},"criterion":{"type":"string"},"prompt":{"type":"string"},"rejected":{"properties":{"artifact_sha256":{"type":"string"},"teacher":{"type":"string"},"verdict":{"enum":["GOLD","SILVER","FAIL"]}},"required":["teacher","verdict","artifact_sha256"],"type":"object"},"schema_version":{"const":"1.0","type":"string"},"task_id":{"type":"string"}},"required":["schema_version","task_id","prompt","chosen","rejected"],"title":"preference.v1","type":"object"}